rep.num,original.study.number,original.effect.size,replication.effect.size,replication.study.number,outcome,target.effect,rep.effort.type,IVs,DVs,replication.type,replication.method.differences,replication.positive.control.evidence,other.outcomes,discipline,rep.num.in.set,original.study.article.URL,replication.study.article.URL,replication.open.data.URL,replication.open.materials.URL,replication.pre.reg.URL,original.open.data.URL,original.open.materials.URL,original.pre.reg.URL,effect.description,design,statistical.effect.type,original.test.statistic,original.pvalue,original.N,replication.N,outcome.bayesian,study.order.CS,RPP.study.number,original.article.title
1,Monin et al. (2008) Study 4,η²(N=67) = .241,η²(N=75) = .052,Holubar & Frank (2015) ,unsuccessful,rebel vs obedient liking effect,Replicability Project,,,very close,,,,social,1,http://www.ask-force.org/web/Discourse/Monin-Rejection-Moral-Rebels-2008.pdf,http://datacolada.org/wp-content/uploads/2016/03/5341-Nosek-et-al-Science-2015-Estimating-the-reproducibility-of-psychological-science.pdf,https://osf.io/pz0my/,https://osf.io/pz0my/,https://osf.io/a4fmg/,,,,Decreased liking for rebels compared to obedient confederates (in non-self-affirmed control condition) eliminated in self-affirmed condition ,"ANOVA, omnibus",main effect,"F(2, 64) = 10.17",<.01,67,75,,1,43,The rejection of moral rebels: Resenting those who do the right thing.
2,Payne et al. (2008) Study 4,R²(N=70) = .09,R²(N=180) = .016,Vianello (2015),successful,implicit-explicit correspondence effect,Replicability Project,,,very close,,,,social,2,https://pdfs.semanticscholar.org/0b28/0b8e08cd35cce13fc6cca1a25dc2b9a7e696.pdf,http://datacolada.org/wp-content/uploads/2016/03/5341-Nosek-et-al-Science-2015-Estimating-the-reproducibility-of-psychological-science.pdf,https://osf.io/rc6mv/,https://osf.io/rc6mv/,https://osf.io/79y8g/,,,,Positive relation between indirect ratings (AMP) and direct ratings (of Black vs. White faces) stronger in low (compared to high) pressure to respond in socially desirable manner conditions. ,hierarchical multiple linear regression,correlation,t(67) = 3.08,<.01,70,180,,2,44,Why do implicit and explicit attitude tests diverge? The role of structural fit.
3,"Soto, John et al. (2008) Study 1","F(21, 230025)(N=230047) = 118.15","F(21, 455304)(N=455326) = 261.93",Soderberg (2015),successful,young acquiescent variability effect,Replicability Project,,,very close,,,,social,3,https://pdfs.semanticscholar.org/0f4f/d4199114ba21c832edc1800d92fd5c5f4034.pdf,http://datacolada.org/wp-content/uploads/2016/03/5341-Nosek-et-al-Science-2015-Estimating-the-reproducibility-of-psychological-science.pdf,https://osf.io/kez47/,https://osf.io/kez47/,https://osf.io/6zdct/,,,,Younger respondents show greater variability (variance) in acquiescent response tendencies than older respondents. ,Levene's test for equality of variance,main effect,"F(21, 230025) = 118.15",<.001,230047,455326,,3,46,"The developmental psychometrics of big five self-reports: Acquiescence, factor structure, coherence, and differentiation from ages 10 to 20."
4,"Cox, Arndt et al. (2008) Study 6",f²(N=100) = .289,f²(N=200) = .05,"Wissink, Zeelenberg et al. (2015)",unsuccessful,anxious attachment mortality effect,Replicability Project,,,very close,,,,social,4,,http://datacolada.org/wp-content/uploads/2016/03/5341-Nosek-et-al-Science-2015-Estimating-the-reproducibility-of-psychological-science.pdf,https://osf.io/5tbxf/,https://osf.io/5tbxf/,https://osf.io/uhnd2/,,,,Increased relative preference for parent among mortality-salience induced Ps scoring low on avoidance but high on anxiety compared to control conditions (dental pain) ,independent samples t-test,main effect,t(92)= -2.22,0.03,100,200,,4,48,Terror management and adults' attachment to their parents: The safe haven remains.
5,Albarracin  et al. (2008) Study 5,η²(N=36) = .143,η²(N=88) = .001,"Kim, Frank et al. (2015)",unsuccessful,action priming boosts cognitive performance,Replicability Project,,,very close,,,,social,5,https://pdfs.semanticscholar.org/dac5/23772e965444540d31e0fb743464fbb56b0e.pdf?_ga=2.187221102.756229126.1510337183-1264817730.1510337183,http://datacolada.org/wp-content/uploads/2016/03/5341-Nosek-et-al-Science-2015-Estimating-the-reproducibility-of-psychological-science.pdf,https://osf.io/vy1bc/,https://osf.io/vy1bc/,https://osf.io/2pbaf/,,,,Ps primed with action words correctly solved higher number of SAT-type verbal and math problems than Ps primed with inaction words. ,ANOVA,main effect,"F(1, 34) = 5.68",0.02,36,88,,5,49,Increasing and decreasing motor and cognitive output: A model of general action and inaction goals.
6,Albarracin  et al. (2008) Study 7,η²(N=98) = .087,η²(N=105) = .049,Voracek & Sonnleitner (2015),unsuccessful,action priming boosts # of thoughts effect,Replicability Project,,,very close,,,,social,6,https://pdfs.semanticscholar.org/dac5/23772e965444540d31e0fb743464fbb56b0e.pdf?_ga=2.187221102.756229126.1510337183-1264817730.1510337183,http://datacolada.org/wp-content/uploads/2016/03/5341-Nosek-et-al-Science-2015-Estimating-the-reproducibility-of-psychological-science.pdf,https://osf.io/rgm6p/,https://osf.io/rgm6p/,https://osf.io/xbyqd/,,,,"Action-word primed Ps completing an inactive task generated a greater number of thoughts compared to inaction-primed Ps completing an active task, with no difference in thoughts in control conditions. ",between ANOVA,interaction,"F(2, 92) = 4.36",0.02,98,105,,6,50,Increasing and decreasing motor and cognitive output: A model of general action and inaction goals.
7,"Centerbar, Schnall et al. (2008) Study 5",η²(N=133) = .040,η²(N=113) = .014,"Humphries, Brown et al. (2015)",unsuccessful,affective incoherence effect,Replicability Project,,,very close,,,,social,7,https://pdfs.semanticscholar.org/7f67/facff28bac9ae369ec0e635863c25fa147e3.pdf?_ga=2.187221102.756229126.1510337183-1264817730.1510337183,http://datacolada.org/wp-content/uploads/2016/03/5341-Nosek-et-al-Science-2015-Estimating-the-reproducibility-of-psychological-science.pdf,https://osf.io/l8srm/,https://osf.io/l8srm/,https://osf.io/wcgx5/,,,,Affective coherence increased cognitive complexity in participant-generated narratives compared to affective incoherence. ,RM ANOVA,interaction,"F(1, 131) = 5.79",<.02,133,113,,7,52,Affective incoherence: When affective concepts and embodied reactions clash.
8,"Amodio, Devine et al. (2008) Study 2",η²(N=48) = .16,η²(N=75) = .006,"Johnson, Graham et al. (2015)",unsuccessful,intergroup bias regulation effect,Replicability Project,,,very close,,,,social,8,https://pdfs.semanticscholar.org/f071/dae9159b3f93e540c928692dfbd6097bc1bf.pdf?_ga=2.187221102.756229126.1510337183-1264817730.1510337183,http://datacolada.org/wp-content/uploads/2016/03/5341-Nosek-et-al-Science-2015-Estimating-the-reproducibility-of-psychological-science.pdf,https://osf.io/wkgpq/,https://osf.io/wkgpq/,https://osf.io/ysxmf/,,,,Low-prejudice Ps whose non-prejudiced responses were motivated by internal (but not external) factors exhibited better control on a stereotype-inhibition task than did Ps motivated by a combination of internal and external factors.,mixed ANOVA,interaction,"F(1, 31) = 5.14",0.03,48,75,,8,53,Individual differences in the regulation of intergroup bias: The role of conflict monitoring and neural signals for control.
9,Harmon-Jones et al. (2008) Study 2,η²(N=57) = .11,η²(N=71) = .01,Gable & Mechin (2015),unsuccessful,action-oriented mindset dissonance effect,Replicability Project,,,very close,,,,social,9,https://pdfs.semanticscholar.org/df6f/78f60a3aef237604e02636657343f0e4e974.pdf?_ga=2.227535963.756229126.1510337183-1264817730.1510337183,http://datacolada.org/wp-content/uploads/2016/03/5341-Nosek-et-al-Science-2015-Estimating-the-reproducibility-of-psychological-science.pdf,https://osf.io/su6bm/,https://osf.io/su6bm/,https://osf.io/zpwne/,,,,"Action-oriented mindset caused attitude changes from pre- to post-decision to both chosen and rejected alternatives, whereas positive-nonaction and neutral mindsets caused attitude changes solely to rejected alternative. ",RM ANOVA,interaction,"F(2, 54) = 3.19",<.05,57,71,,9,55,Left frontal cortical activation and spreading of alternatives: Tests of the action-based model of dissonance.
10,"van Dijk, van Kleef et al. (2008) Study 3",η²(N=103) = .143,d(N=83) = .082,Voracek & Slowik (2015),unsuccessful,anger communication bargaining effect,Replicability Project,,,very close,,,,social,10,https://pdfs.semanticscholar.org/16af/db45ada4a1951aa464be49ef82ac6eebf0c1.pdf?_ga=2.227535963.756229126.1510337183-1264817730.1510337183,http://datacolada.org/wp-content/uploads/2016/03/5341-Nosek-et-al-Science-2015-Estimating-the-reproducibility-of-psychological-science.pdf,https://osf.io/xtsq6/,https://osf.io/xtsq6/,https://osf.io/2idfu/,,,,"Ps made lower bargaining offers to angry (compared to happy) recipients than happy, but only when consequences of rejection were low. ",ANOVA,main effect,"F(1, 99) = 16.62",<.0001,103,83,,10,56,A social functional approach to emotions in bargaining: when communicating anger pays and when it backfires.
11,Lemay & Clark (2008a) Study 5,η²(N=186) = .028,η²(N=280) = .001,Baranski (2015),unsuccessful,walking on eggshells effect,Replicability Project,,,very close,,,,social,11,https://pdfs.semanticscholar.org/7d50/911e5a1e8199449e74e82ab7515c33695ff8.pdf?_ga=2.227535963.756229126.1510337183-1264817730.1510337183,http://datacolada.org/wp-content/uploads/2016/03/5341-Nosek-et-al-Science-2015-Estimating-the-reproducibility-of-psychological-science.pdf,https://osf.io/ke43j/,https://osf.io/ke43j/,https://osf.io/efjn3/,,,,"Ps believed confederate's expressions were happier than their private feelings, but only in vulnerable conditions. ",RM ANOVA,interaction,"F(1, 182) = 5.24",<.05,186,280,,11,58,Walking on eggshells: How expressing relationship insecurities perpetuates them.
12,Lemay & Clark (2008b) Study 5,level 1 R²(N=153) = .68,b(N=216) = .72,"Marigold, Forest et al. (2015)",successful,head liberates heart effect,Replicability Project,,,very close,,,,social,12,https://pdfs.semanticscholar.org/7b10/2f1d04ba874821f66569d41683070b783bd5.pdf?_ga=2.227535963.756229126.1510337183-1264817730.1510337183,http://datacolada.org/wp-content/uploads/2016/03/5341-Nosek-et-al-Science-2015-Estimating-the-reproducibility-of-psychological-science.pdf,https://osf.io/h84qd/,https://osf.io/h84qd/,https://osf.io/mv3i7/,,,,Ps own responsiveness was a significant predictor of their perception of their partners' responsiveness. ,multilevel model,regression,b = .68,<.001,153,216,,12,59,How the head liberates the heart: Projection of communal responsiveness guides relationship promotion.
13,Ersner-Hershfield et al. (2008) Study 2,d(N=110) = +.45,d(N=222) = -.01,"Talhelm, Eggleston, & Lee (2015a)",unsuccessful,poignancy effect,Replicability Project,,,very close,,,,social,13,https://pdfs.semanticscholar.org/72a0/2b6869a1330a4090a9ddfb21674c6a0e21fe.pdf?_ga=2.139570293.756229126.1510337183-1264817730.1510337183,http://datacolada.org/wp-content/uploads/2016/03/5341-Nosek-et-al-Science-2015-Estimating-the-reproducibility-of-psychological-science.pdf,https://osf.io/sq8k9/,https://osf.io/sq8k9/,https://osf.io/fw6hv/,,,,Ps (college seniors) reminded they were experiencing their last day as students at graduation reported fewer mixed emotions than Ps not reminded. ,independent-samples t-test,main effect,t(108) = -2.34,<.05,110,222,,13,61,Poignancy: Mixed emotional experience in the face of meaningful endings.
14,Correll (2008) Study 2,d(N=71) = +.59 ± .51,d(N=148) = +.16 ± .34,LeBel (2015) Study 1,unsuccessful,modulation of 1/f noise racial bias emission effect,Replicability Project,avoid/use race information vs. control instructions,1/f noise (weapon identification task),very close,Canadian rather than US undergraduates; keyboard used instead of response box;,Racial bias (in terms of RT) higher in use and avoid race (compared to control) conditions (d = .34 ± .35); 1/f noise observed within each of the 3 conditions (p<.0001),,social,14,https://github.com/eplebel/science-commons/blob/master/curated/correll(2008).pdf,http://datacolada.org/wp-content/uploads/2016/03/5341-Nosek-et-al-Science-2015-Estimating-the-reproducibility-of-psychological-science.pdf,https://osf.io/fejxb/,https://osf.io/fejxb/,https://osf.io/hzka3/,,,,Ps in use-race or avoid-race instruction conditions exhibited less 1/f noise (as reflected in PSD slopes) on WIT than Ps in a control condition. ,between ANOVA using planned orthogonal contrasts,contrast,"F(1, 68) = 5.52",<.02,71,148,,14,63,1/f noise and effort on implicit measures of bias.
15,"Forster, Liberman et al. (2008) Study 1",η²(N=82) = .362,η²(N=71) = .026,Reinhard (2015),unsuccessful,aggression priming perceptual effect,Replicability Project,,,very close,,,,social,15,https://pdfs.semanticscholar.org/4643/46b57725371f6d93e625699667ad784cb3bd.pdf?_ga=2.197004522.756229126.1510337183-1264817730.1510337183,http://datacolada.org/wp-content/uploads/2016/03/5341-Nosek-et-al-Science-2015-Estimating-the-reproducibility-of-psychological-science.pdf,https://osf.io/mxryb/,https://osf.io/mxryb/,https://osf.io/sxnu6/,,,,Aggression priming increased perceptions of aggression (assimilation effect) among Ps whose processing style induced to be global (or control) whereas it decreased perceptions of aggression (contrast affect) among Ps whose processing style induced to be local. ,ANOVA,interaction,"F(2, 76) = 21.57",<.0001,82,71,,15,64,The effect of global versus local processing styles on assimilation versus contrast in social judgment.
16,"Exline, Baumeister et al. (2008) Study 7",η²(N=45) = .186,η²(N=135) = .001,Lin & Frank (2015),unsuccessful,not so innocent effect,Replicability Project,,,very close,,,,social,16,,http://datacolada.org/wp-content/uploads/2016/03/5341-Nosek-et-al-Science-2015-Estimating-the-reproducibility-of-psychological-science.pdf,https://osf.io/imrx2/,https://osf.io/imrx2/,https://osf.io/es7ub/,,,,Subtly asking Ps questions about their empathic understanding and capability of exhibiting similar transgressions reduced male (but not female) Ps' feelings of vengefulness. ,ANOVA,interaction,"F(1, 41) = 9.40",<.01,45,135,,16,65,Not so innocent: Does seeing one's own capacity for wrongdoing predict forgiveness?
17,Risen & Gilovich (2008) Study 6,η²(N=122) = .035,η²(N=226) = .000,Mathur & Frank (2015),unsuccessful,tempting fate effect,Replicability Project,,,very close,,,,social,17,https://pdfs.semanticscholar.org/d828/30e4f7686ca44031a62d002bb9349ce6d5be.pdf?_ga=2.160491515.756229126.1510337183-1264817730.1510337183,http://datacolada.org/wp-content/uploads/2016/03/5341-Nosek-et-al-Science-2015-Estimating-the-reproducibility-of-psychological-science.pdf,https://osf.io/sg3su/,https://osf.io/sg3su/,https://osf.io/nwua6/,,,,Tempting fate effect (tempting fate increases perceived likelihood of negative outcomes) amplified under cognitive load compared to a control condition. ,ANOVA,interaction,"F(1, 116) = 4.15",<.05,122,226,,17,68,Why people are reluctant to tempt fate.
18,Tracy & Robins (2008) Study 4,Av. Proportion(N=211) = .78,Av. proportion(N=333) = .77,Sullivan (2015),successful,cross-cultural nonverbal pride expression effect,Replicability Project,,,very close,,,,social,18,https://pdfs.semanticscholar.org/2acf/75b16de98f1e49b8d62dcaddc0e8193488f8.pdf?_ga=2.233351384.756229126.1510337183-1264817730.1510337183,http://datacolada.org/wp-content/uploads/2016/03/5341-Nosek-et-al-Science-2015-Estimating-the-reproducibility-of-psychological-science.pdf,https://osf.io/qthf2/,https://osf.io/qthf2/,https://osf.io/9uqxr/,,,,"Ps recognized conveyed emotions as pride at an above chance level, no matter what culture target represented. ",binomial test,binomial test,X,<.05,211,333,,18,69,The nonverbal expression of pride: Evidence for cross-cultural recognition.
19,Stanovich & West (2008) Study 8,d(N=375) = +.493,d(N=177) = +.15,Baranski (2015),unsuccessful,Wason task performance and cognitive ability correlation,Replicability Project,,,very close,,,,social,19,https://pdfs.semanticscholar.org/372b/31dd367450ee278ebc6bfe2d50287f893c7d.pdf?_ga=2.233351384.756229126.1510337183-1264817730.1510337183,http://datacolada.org/wp-content/uploads/2016/03/5341-Nosek-et-al-Science-2015-Estimating-the-reproducibility-of-psychological-science.pdf,https://osf.io/7ux8p/,https://osf.io/7ux8p/,https://osf.io/p3gz2/,,,,Ps correctly answering Wason's four-card selection task exhibited higher cognitive ability (SAT scores) than Ps answering card task incorrectly. ,independent samples t-test,main effect,t(373) = 4.40,<.001,375,177,,19,71,On the relative independence of thinking biases and cognitive ability.
20,Blankenship & Wegener (2008) Study 5a,η²(N=261) = .042,η²(N=251) = .002,Lemm (2015),unsuccessful,closed open mind effect,Replicability Project,,,very close,,,,social,20,https://pdfs.semanticscholar.org/f853/aa287ee48bcfcfcc1f807fa10faeccc04d0f.pdf?_ga=2.233351384.756229126.1510337183-1264817730.1510337183,http://datacolada.org/wp-content/uploads/2016/03/5341-Nosek-et-al-Science-2015-Estimating-the-reproducibility-of-psychological-science.pdf,https://osf.io/2gx4k/,https://osf.io/2gx4k/,https://osf.io/v3e2z/,,,,"Strong arguments more persuasive than weak arguments among Ps forced to focus on important values in the messages, but no argument strength effect among Ps forced to focus on unimportant values. ",ANOVA,interaction,"F(1, 257) = 11.58",0.002,261,251,,20,72,Opening the mind to close it: Considering a message in light of important values increases message processing and later resistance to change.
21,Morrison & Miller (2008) Study 3,Φ (phi)(N=37) = .32,Φ (phi)(N=120) = .20,Motyl (2015),successful,descriptive deviant popularity effect,Replicability Project,,,very close,,,,social,21,,http://datacolada.org/wp-content/uploads/2016/03/5341-Nosek-et-al-Science-2015-Estimating-the-reproducibility-of-psychological-science.pdf,https://osf.io/nhwv5/,https://osf.io/nhwv5/,https://osf.io/2jwi6/,,,,Bumper stickers of descriptive deviants rated as more popular than bumper stickers of prescriptive deviants. ,Pearson's Chi-squared test,main effect,"X^2(1, N=37) = 3.85",<.05,37,120,,21,73,Distinguishing between silent and vocal minorities: Not all deviants feel marginal.
22,Koo & Fishbach (2008) Study 4,η²(N=246) = .041,OR(N=768703) = .159,Kidwell & Dodson (2015),unsuccessful,(un)accomplished goal action effect,Replicability Project,,,very close,,,,social,22,https://pdfs.semanticscholar.org/430d/1ea2b5233cb303dfa5eb39d8e67bd5c84e42.pdf?_ga=2.228124123.756229126.1510337183-1264817730.1510337183,http://datacolada.org/wp-content/uploads/2016/03/5341-Nosek-et-al-Science-2015-Estimating-the-reproducibility-of-psychological-science.pdf,https://osf.io/nr7d9/,https://osf.io/nr7d9/,https://osf.io/68m2c/,,,,"Increased donations to HIV/AIDS initiative when emphasizing ""to-date"" information among Ps who hadn't yet donated, but emphasizing ""to-go"" information among Ps who had. ",ANOVA,interaction,"F(1, 242) = 10.47",<.01,246,768703,,22,77,Dynamics of self-regulation: How (un) accomplished goal actions affect motivation.
23,"Henderson, de Liver et al. (2008) Study 5",η²(N=46) = .135,η²(N=70) = .048,Lane & Gazarian (2015),unsuccessful,implemental mind-set attitude strength effect,Replicability Project,,,very close,,,,social,23,https://pdfs.semanticscholar.org/aa89/13651dae184a14a3186c74a9570b80a9ce1a.pdf?_ga=2.38709349.756229126.1510337183-1264817730.1510337183,http://datacolada.org/wp-content/uploads/2016/03/5341-Nosek-et-al-Science-2015-Estimating-the-reproducibility-of-psychological-science.pdf,https://osf.io/79dey/,https://osf.io/79dey/,https://osf.io/cjr7d/,,,,Ps in one-sided focus condition exhibited less ambivalence than participants in two-sided focus condition. ,ANOVA,main effect,"F(2, 43) = 3.36",<.05,46,70,,23,80,The effects of an implemental mind-set on attitude strength.
24,Shnabel & Nadler (2008) Study 4,η²(N=94) = .07,η²(N=141) = .010,E. Gilbert (2015),unsuccessful,need for acceptance reconcialiation effect,Replicability Project,,,very close,,,,social,24,https://pdfs.semanticscholar.org/9e10/97af99a1b9d8e2e178170bf700feed1fd1d8.pdf?_ga=2.38709349.756229126.1510337183-1264817730.1510337183,http://datacolada.org/wp-content/uploads/2016/03/5341-Nosek-et-al-Science-2015-Estimating-the-reproducibility-of-psychological-science.pdf,https://osf.io/xse7q/,https://osf.io/xse7q/,https://osf.io/fuj2c/,,,,"Ps in perpetrator condition reported higher need for social acceptance and reconciliation after moral acceptance was restored, whereas Ps in victim condition reported higher need for power and reconciliation after sense of power was restored.",between ANOVA,interaction,"F(1, 90) = 6.98",<.05,94,141,,24,81,A needs-based model of reconciliation: Satisfying the differential emotional needs of victim and perpetrator as a key to promoting reconciliation.
25,Rule & Ambady (2008) Study 1,r(N=50) = +.30,r(N=50) = +.27,"Talhelm, Eggleston, & Lee (2015b)",unsuccessful,face of success effect,Replicability Project,,,very close,,,,social,25,https://pdfs.semanticscholar.org/71d5/3c7980b9561ffd56e6012b2bbb6685209df3.pdf?_ga=2.38709349.756229126.1510337183-1264817730.1510337183,http://datacolada.org/wp-content/uploads/2016/03/5341-Nosek-et-al-Science-2015-Estimating-the-reproducibility-of-psychological-science.pdf,https://osf.io/r5gpv/,https://osf.io/r5gpv/,https://osf.io/4peq6/,,,,"Composite ratings of perceived power and leadership positively correlated with company profits, even after controlling for CEO age, CEO attractiveness, and affect CEOs displayed in photo. ",partial correlation,correlation,r(41) = .30,<.05,50,50,,25,82,The face of success: inferences from chief executive officers' appearance predict company profits.
26,"Fischer, Schulz-Hardt et al. (2008) Study 4",d(N=52) = +1.17,d(N=150) = +.46,Ratliff (2015),successful,selective exposure information quantity effect,Replicability Project,,,very close,,,,social,26,,http://datacolada.org/wp-content/uploads/2016/03/5341-Nosek-et-al-Science-2015-Estimating-the-reproducibility-of-psychological-science.pdf,https://osf.io/v8vft/,https://osf.io/v8vft/,https://osf.io/5afur/,,,,"Decision-makers prefer inconsistent information when choosing between two pieces of information, but prefer consistent information when choosing between more pieces of information. ",Pearson's Chi-squared test,interaction,"X^2(1, N=52) = 13.18",0.001,52,150,,26,84,Selective exposure and information quantity: How different information quantities moderate decision makers' preference for consistent and inconsistent information.
27,"Fischer, Greitemeyer et al. (2008) Study 2",η²(N=85) = .09,η²(N=140) = .03,Galliani (2015),unsuccessful,ego depletion confirmatory bias effect,Replicability Project,,,very close,,,,social,27,,http://datacolada.org/wp-content/uploads/2016/03/5341-Nosek-et-al-Science-2015-Estimating-the-reproducibility-of-psychological-science.pdf,https://osf.io/j8bpa/,https://osf.io/j8bpa/,https://osf.io/9pnct/,,,,Ps whose self-regulation resources depleted exhibited increased biases in confirmatory information processing compared to non-depleted and ego-threatened condition Ps ,between ANOVA,main effect,"F(2, 82) = 4.05",0.02,85,140,,27,86,Self-regulation and selective exposure: The impact of depleted self-regulation resources on confirmatory information processing.
28,"Goff, Steele et al. (2008) Study 4",η²(N=55) = .16,η²(N=51) = .002,"Kelso, Gampa, Wright et al. (2015)",unsuccessful,stereotype threat interaction distance effect,Replicability Project,,,very close,,,,social,28,https://pdfs.semanticscholar.org/e2d7/50c087773d3d19b488007b16e70aef0a1ce4.pdf?_ga=2.159777915.756229126.1510337183-1264817730.1510337183,http://datacolada.org/wp-content/uploads/2016/03/5341-Nosek-et-al-Science-2015-Estimating-the-reproducibility-of-psychological-science.pdf,https://osf.io/abxcj/,https://osf.io/abxcj/,https://osf.io/7q5us/,,,,"When learning goals absent, Ps sat closer to each other when they discussed love and relationships compared to when they discussed racial profiling. ",between ANOVA,interaction,"F(1, 51) = 9.46",<.01,55,51,,28,87,The space between us: Stereotype threat and distance in interracial contexts.
29,Eastwick & Finkel (2008) Study 1,r(N=163) = +.04,r(N=304) = +.01,"Selterman, Chagnon et al. (2015)",successful,generalized earning prospect predicts romantic interest effect,Replicability Project,,,very close,,,,social,29,https://pdfs.semanticscholar.org/ec64/e26322c7fdbf9e54981a07693974423f3031.pdf?_ga=2.159777915.756229126.1510337183-1264817730.1510337183,http://datacolada.org/wp-content/uploads/2016/03/5341-Nosek-et-al-Science-2015-Estimating-the-reproducibility-of-psychological-science.pdf,https://osf.io/ng6cc/,https://osf.io/ng6cc/,https://osf.io/5pjsn/,,,,Perceived earning prospects significantly positively predicted romantic interest in speed-dating situation for both men and women (absence of evidence for interaction effect). ,Meta-analytic summary of interaction effects in 14 multilevel models,interaction,t(26) = 0.72,0.48,163,304,,29,89,Sex differences in mate preferences revisited: Do people know what they initially desire in a romantic partner?
